{
  "name": "basic",
  "description": "Five media messages including one probe (excluded) and one audio batch (included).",
  "session_id": "ses_01K5RMQ2G0VECT0R0000000001",
  "jti": "AAECAwQFBgcICQoLDA0ODw",
  "token": "eyJhbGciOiJFUzI1NiIsInR5cCI6IkpXVCIsImtpZCI6Inpha2FkaS12ZWN0b3JzLXRlc3QtMSJ9.eyJpc3MiOiJhcGkuemFrYWRpLmRldiIsImF1ZCI6ImluZ2VzdCIsInN1YiI6InNlc18wMUs1Uk1RMkcwVkVDVDBSMDAwMDAwMDAwMSIsInRpZCI6InRlbmFudCIsImp0aSI6IkFBRUNBd1FGQmdjSUNRb0xEQTBPRHciLCJpYXQiOjE3NTg1NDI0MDAsIm5iZiI6MTc1ODU0MjQwMCwiZXhwIjoxNzU4NTQyNzAwLCJwb2wiOjEyLCJiYW5kX21heCI6IkIiLCJpbmciOlsiZXUtd2VzdC0yIl0sIm5vbmNlIjoiOEowd1l3Nk5NUXhSazRiM3d2a0FnQSIsImxhbmciOiJlbi1ORyJ9.it_qSLjo3Phxizz1zo6fOaEyfA0Xib3-MGT61di4kvVk0OIq_vw0arq15MxNXdMuiieNR5P9XsoXeN51vutYxw",
  "h0": "816389b3a512fed2bb11616da34e2b550ff49a195e0033cf9a28e64abcd09884",
  "messages": [
    {
      "hex": "0c200000000000000000000167443254ede5320d51dd2e9ddf05f90aa25b429270d46a532f00000001680ad5d2f4860e422ed74a751265f88c16ec8856511bdc4ac8ee6f4177cb43f3210000000165d17750fa28eb770cd2664d46c6f60e8b7dcf1b32614f4160f4b9c323c0ae2d4f036ad81916c43c75",
      "chained": true,
      "chain_after": "a99b1fb9301e93c11ea5783779c45a77d2b0f5a692bbf58359f265898df69a01"
    },
    {
      "hex": "10200000000000000ad5d2f4860e422ed74a751265f88c16ec8856511bdc4ac8ee6f4177cb43f3215f8c38d7361efa4b1c97fdd2374c4e3ae1f58c524717da32c3359f4ef9",
      "chained": true,
      "chain_after": "9037f7dcf3338e940200f1b1930fd7f6bcd0e6f4c39a8fec6294dd562038d1f6"
    },
    {
      "hex": "20000000000000008813000000000000d17750fa28eb770cd2664d46c6f60e8b7dcf1b32614f4160f4b9c323c0ae2d4f036ad81916c43c75a1e4f82f80c1a3cb7462501e8ad0e3a9",
      "chained": false,
      "chain_after": "9037f7dcf3338e940200f1b1930fd7f6bcd0e6f4c39a8fec6294dd562038d1f6"
    },
    {
      "hex": "30200100140000003c000000971acd01c9c7adeacc83257926f490ff0e15e013a7c237f9fa0346cfb618667da748785af66a7d9f2630f48cca37f75c06cf14e9cd8aec1fd4868e223b0014005dbd4b076aa3e2c8c69ffdac86f21274a05ca5f4ee352e91014cc97bab83a0ab4b26189cd610bec9aa7cf0e913ac4bed993cd8b50f43f5965d2f05",
      "chained": true,
      "chain_after": "ee6e0895e8e51c02975becfd64c6542cda4095723a8e34f5c7350fff745e5eda"
    },
    {
      "hex": "00200100430000000000000161245fc90e0b8017a6c0bcd5dfe7f194e831a26ad534a82529",
      "chained": true,
      "chain_after": "8ceea195df3694538d2c4423ef0a9719d32f78041a1fc60ba8e41b57072b7ed5"
    }
  ],
  "attest": {
    "t": "attest",
    "video_seq": 1,
    "audio_seq": 1,
    "chain": "8ceea195df3694538d2c4423ef0a9719d32f78041a1fc60ba8e41b57072b7ed5"
  }
}
