{
  "name": "probes-only",
  "description": "Only probes were sent: the chain still equals H0.",
  "session_id": "ses_01J8VECTOR000000000001",
  "jti": "AAECAwQFBgcICQoLDA0ODw",
  "token": "eyJhbGciOiJFUzI1NiIsImtpZCI6InRlc3QifQ.eyJpc3MiOiJhcGkuemFrYWRpLmRldiIsImF1ZCI6ImluZ2VzdCIsInN1YiI6InNlc18wMUo4VkVDVE9SMDAwMDAwMDAwMDAxIiwidGlkIjoidGVuYW50IiwianRpIjoiQUFFQ0F3UUZCZ2NJQ1FvTERBME9EdyIsImlhdCI6MTc1ODU0MjQwMCwibmJmIjoxNzU4NTQyNDAwLCJleHAiOjE3NTg1NDI3MDAsInBvbCI6MTIsImJhbmRfbWF4IjoiQiIsImluZyI6WyJldS13ZXN0LTIiXSwibm9uY2UiOiI4SjB3WXc2Tk1ReFJrNGIzd3ZrQWdBIiwibGFuZyI6ImVuLU5HIn0.dGVzdC1zaWduYXR1cmUtbm90LXZhbGlk",
  "h0": "ff767c311c91cf24a24d4e96313b0eaffb8dff7253655bb014cad3b3da232b01",
  "messages": [
    {
      "hex": "2000000000000000e8030000000000003deac02891f1ed1da82d35ac69e99cba76bc7d584d73ff8b21bc56d87697bf917f7d39e2374d049b41fadbbb80f6f1c0765dacb15ee223e7",
      "chained": false,
      "chain_after": "ff767c311c91cf24a24d4e96313b0eaffb8dff7253655bb014cad3b3da232b01"
    },
    {
      "hex": "2000010000000000e903000000000000038c3e2e32cd22fba2490ddfc9e81e2f0703423994e5f6232706d9846b01f9bf235bda2417f245c5c646d718ca6b455109ca707da09b2c5e",
      "chained": false,
      "chain_after": "ff767c311c91cf24a24d4e96313b0eaffb8dff7253655bb014cad3b3da232b01"
    },
    {
      "hex": "2000020000000000ea03000000000000c92fbb34d3aa57d99c66e4122ae6a1a39949071ada58ecbc2e4f5c30616c32eec7397a65f89887ef4a93d37513e199e29b373448e35435d5",
      "chained": false,
      "chain_after": "ff767c311c91cf24a24d4e96313b0eaffb8dff7253655bb014cad3b3da232b01"
    }
  ],
  "attest": {
    "t": "attest",
    "video_seq": 0,
    "audio_seq": 0,
    "chain": "ff767c311c91cf24a24d4e96313b0eaffb8dff7253655bb014cad3b3da232b01"
  }
}
